,Author,Author1,City,No.,Title,Type,Year,Year1,adjust,adjustment,anti-dumping,cheap,china,compete,competition,dumping,economy,export,free trade,free trade agreeement,grow,growthmanufacturingworld,import,labor union,liberalization,liberalizelabor,mexico,nafta,protect,protection,rust belt,subsidy,unemploy,unemployment,wto
603,John McCain,John McCain,New York City,154,Remarks at the Al Smith Dinner in New York City,remarks,2008,2008,0,0,0,0,0,0,0,0,0,0,0,0,0,0,0,0,0,0,0,0,0,0,0,0,0,0,0
604,John McCain,John McCain,0,155,"Remarks in Downingtown, Pennsylvania",remarks,2008,2008,0,0,0,0,0,0,1,0,6,0,0,0,0,0,2,0,0,0,0,0,1,0,0,0,0,0,0
605,John McCain,John McCain,Miami,156,"Remarks in Miami, Florida",remarks,2008,2008,0,0,0,0,0,0,1,0,6,0,0,0,0,0,2,0,0,0,0,0,2,0,0,0,0,0,0
606,John McCain,John McCain,0,157,Senator McCain's Weekly Radio Address,address,2008,2008,0,0,0,0,0,0,0,0,0,0,0,0,1,0,0,0,0,0,0,0,0,0,0,0,0,0,0
607,John McCain,John McCain,Concord,158,"Remarks in Concord, North Carolina",remarks,2008,2008,0,0,0,0,0,0,1,0,6,0,0,0,1,0,1,0,0,0,0,0,1,0,0,0,0,0,0
608,John McCain,John McCain,0,159,Interview with Chris Wallace on Fox News Sunday,interview,2008,2008,0,0,0,0,0,0,0,0,10,0,1,0,1,0,0,0,0,0,0,0,1,1,0,0,0,0,0
609,John McCain,John McCain,Belton,160,"Remarks in Belton, Missouri",remarks,2008,2008,0,0,0,0,0,0,1,0,6,0,0,0,2,0,1,0,0,0,0,0,1,0,0,0,0,0,0
610,John McCain,John McCain,0,161,"Remarks at St. Anslem College in Goffstown, New Hampshire",remarks,2008,2008,0,0,0,0,0,0,0,0,3,0,0,0,0,0,0,0,0,0,0,0,0,0,0,0,1,1,0
611,John McCain,John McCain,0,162,"Interview with Wolf Blitzer on CNN's ""The Situation Room""",interview,2008,2008,0,0,0,0,1,0,0,0,3,0,0,0,0,0,3,0,0,0,0,0,8,1,0,0,0,0,0
612,John McCain,John McCain,Denver,163,"Remarks in Denver, Colorado",remarks,2008,2008,0,0,0,0,0,0,0,0,7,0,0,0,1,0,1,0,0,0,0,0,1,0,0,0,1,0,0
613,John McCain,John McCain,0,164,"Interview with Tom Brokaw on NBC's ""Meet the Press""",interview,2008,2008,0,0,0,0,0,0,0,0,4,0,0,0,0,0,2,0,0,0,0,0,1,1,0,0,0,0,0
614,John McCain,John McCain,Dayton,165,"Remarks in Dayton, Ohio",remarks,2008,2008,0,0,0,0,0,0,0,0,6,0,0,0,2,0,1,0,0,0,0,0,0,0,0,0,0,0,0
615,John McCain,John McCain,Cleveland,166,"Remarks After Holding a Meeting on the State of the Economy in Cleveland, Ohio",remarks,2008,2008,0,0,0,0,0,0,0,0,6,0,0,0,9,0,1,0,0,0,0,0,3,0,0,0,0,0,0
616,John McCain,John McCain,0,167,"Remarks in Hershey, Pennsylvania",remarks,2008,2008,0,0,0,0,0,0,0,0,8,0,0,0,2,0,1,0,0,0,0,0,0,0,0,0,0,0,0
617,John McCain,John McCain,0,168,"Interview with Cindy McCain by Sean Hannity on Fox News' ""Hannity & Colmes""",interview,2008,2008,1,0,0,0,0,0,0,0,5,0,1,0,1,0,5,0,0,0,0,0,1,1,0,0,1,1,0
618,John McCain,John McCain,Miami,169,"Remarks in Miami, Florida",remarks,2008,2008,0,0,0,0,0,0,0,0,10,0,0,0,3,0,1,0,0,0,0,0,0,0,0,0,0,0,0
619,John McCain,John McCain,0,170,Interview with Larry King of CNN,interview,2008,2008,0,0,0,0,0,0,0,0,10,0,0,0,5,0,2,0,0,0,2,0,0,0,0,0,1,1,0
620,John McCain,John McCain,Tampa,171,"Remarks After Holding a National Security Roundtable Meeting in Tampa, Florida",remarks,2008,2008,0,0,0,0,0,0,0,0,1,1,0,0,0,0,0,0,0,0,0,0,2,0,0,0,0,0,0
621,John McCain,John McCain,Columbus,172,"Remarks in Columbus, Ohio",remarks,2008,2008,0,0,0,0,0,0,0,0,6,0,0,0,1,0,1,0,0,0,0,0,4,0,0,0,0,0,0
622,John McCain,John McCain,Miami,173,"Remarks in Miami, Florida",remarks,2008,2008,0,0,0,0,0,0,0,0,2,0,0,0,1,0,0,0,0,0,0,0,4,0,0,0,0,0,0
623,John McCain,John McCain,0,174,Address in Phoenix Conceding the 2008 Presidential Election,address,2008,2008,0,0,0,0,0,0,0,0,0,0,0,0,0,0,0,0,0,0,0,0,0,0,0,0,0,0,0
624,John McCain,John McCain,Grand Junction,175,"Remarks in Grand Junction, Colorado",remarks,2008,2008,0,0,0,0,0,0,0,0,1,0,0,0,0,0,0,0,0,0,0,0,4,0,0,0,0,0,0
625,Mitt Romney,Mitt Romney,0,1,"Remarks at the Seventh Annual Herzliya Conference in Herzliya, Israel",remarks,2008,2008,0,0,0,0,3,0,0,0,4,0,0,0,0,0,1,0,0,0,0,0,0,0,0,0,0,0,0
626,Mitt Romney,Mitt Romney,0,2,"Excerpts From Governor Mitt Romney's Remarks at the Seventh Annual Herzliya Conference in Herzliya, Israel",remarks,2008,2008,0,0,0,0,0,0,0,0,1,0,0,0,0,0,1,0,0,0,0,0,0,0,0,0,0,0,0
627,Mitt Romney,Mitt Romney,0,3,Excerpts from Governor Mitt Romney's Remarks at the Conservative Members Retreat,remarks,2008,2008,0,0,0,0,0,0,0,0,0,0,0,0,0,0,1,0,0,0,0,0,0,0,0,0,0,0,0
628,Mitt Romney,Mitt Romney,Louisville,4,Excerpt of Remarks at the Kentucky GOP Lincoln Day Dinner in Louisville,remarks,2008,2008,0,0,0,0,0,0,0,0,0,0,0,0,0,0,0,0,0,0,0,0,0,0,0,0,0,0,0
629,Mitt Romney,Mitt Romney,0,5,Address to the Detroit Economic Club,address,2008,2008,1,0,0,1,3,2,0,0,20,1,5,0,18,0,1,0,0,0,0,0,4,3,0,0,2,2,0
630,Mitt Romney,Mitt Romney,Dearborn,6,"Address Announcing Candidacy for the Republican Nomination for President in Dearborn, Michigan",address,2008,2008,0,0,0,1,0,0,2,0,1,0,0,0,1,0,1,0,0,0,0,0,2,1,0,0,1,1,0
631,Mitt Romney,Mitt Romney,0,7,"Interview with George Stephanopoulos on ABC News' ""This Week""",interview,2008,2008,0,0,0,1,0,1,0,0,0,0,0,0,0,0,2,0,0,0,0,0,3,0,0,0,0,0,0
632,Mitt Romney,Mitt Romney,Washington,8,"Remarks at the Conservative Political Action Conference in Washington, DC",remarks,2008,2008,0,0,0,0,0,0,1,0,6,0,1,0,3,0,2,0,0,0,0,0,2,0,0,0,0,0,0
633,Mitt Romney,Mitt Romney,0,9,Remarks at the Miami-Dade Lincoln Day Dinner,remarks,2008,2008,0,0,0,0,0,0,0,0,3,0,1,0,3,0,1,0,0,0,0,0,1,0,0,0,0,0,0
634,Mitt Romney,Mitt Romney,College Station,10,"Remarks at the George Bush Presidential Library Center in College Station, Texas",remarks,2008,2008,0,0,0,0,0,1,0,0,5,0,2,0,1,0,1,0,0,0,0,0,4,0,0,0,0,0,0
635,Mitt Romney,Mitt Romney,0,11,Remarks at the Frontiers of Freedom Ronald Reagan Gala,remarks,2008,2008,0,0,0,0,0,0,0,0,0,0,0,0,0,0,1,0,0,0,0,0,1,0,0,0,0,0,0
636,Mitt Romney,Mitt Romney,New York City,12,Remarks at Yeshiva University in New York City,remarks,2008,2008,0,0,0,0,3,0,0,0,1,0,0,0,2,0,1,0,0,0,0,0,3,1,0,0,0,0,0
637,Mitt Romney,Mitt Romney,Virginia Beach,13,"Excerpts From Governor Mitt Romney's Commencement Address At Regent University in Virginia Beach, Virginia",address,2008,2008,0,0,0,0,0,0,0,0,0,0,0,0,0,0,1,0,0,0,0,0,1,0,0,0,0,0,0
638,Mitt Romney,Mitt Romney,0,14,Remarks at the Massachusetts Citizens for Life Mother's Day Pioneer Valley Dinner,remarks,2008,2008,0,0,0,1,0,0,0,0,0,0,0,0,1,0,0,0,0,0,0,0,3,1,0,0,0,0,0
639,Mitt Romney,Mitt Romney,0,15,Excerpts of Governor Mitt Romney's Commencement Address At Hillsdale College,address,2008,2008,0,0,0,0,0,0,1,0,2,0,0,0,0,0,0,0,0,0,0,0,0,0,0,0,0,0,0
640,Mitt Romney,Mitt Romney,0,16,Remarks at the National Right to Life Convention Forum,remarks,2008,2008,0,0,0,1,0,0,0,0,0,0,0,0,1,0,0,0,0,0,0,0,4,1,0,0,0,0,0
641,Mitt Romney,Mitt Romney,0,17,Remarks at the Young Republican National Convention,remarks,2008,2008,0,0,0,0,1,6,0,0,6,0,1,0,2,0,0,0,0,0,0,0,1,0,0,0,1,1,0
642,Mitt Romney,Mitt Romney,0,18,Remarks at the Mackinac Republican Leadership Conference,remarks,2008,2008,0,0,0,0,1,0,0,0,2,0,0,0,0,0,1,0,0,0,0,0,2,0,0,0,0,0,0
643,Mitt Romney,Mitt Romney,0,19,Address to the Family Research Council's Values Voter Summit,address,2008,2008,1,0,0,0,0,0,0,0,1,0,0,0,1,0,3,0,0,0,0,0,5,0,0,0,0,0,0
644,Mitt Romney,Mitt Romney,College Station,20,"Address at the George Bush Presidential Library in College Station, Texas",address,2008,2008,0,0,0,0,1,0,0,0,0,0,0,0,0,0,2,0,0,0,0,0,2,1,0,0,0,0,0
645,Mitt Romney,Mitt Romney,0,21,"Interview with Tim Russert on NBC News' ""Meet the Press""",interview,2008,2008,0,0,0,0,1,0,0,0,1,0,0,0,2,0,4,0,0,0,0,0,2,1,0,0,0,0,0
646,Mitt Romney,Mitt Romney,0,22,Remarks Following the Iowa Caucuses,remarks,2008,2008,0,0,0,0,0,0,0,0,0,0,0,0,0,0,0,0,0,0,0,0,0,0,0,0,0,0,0
647,Mitt Romney,Mitt Romney,0,23,Remarks Following the New Hampshire Primary,remarks,2008,2008,0,0,0,0,0,1,0,0,2,0,0,0,0,0,0,0,0,0,0,0,1,0,0,0,0,0,0
648,Mitt Romney,Mitt Romney,0,24,"Interview with Bob Schieffer on CBS News' ""Face the Nation""",interview,2008,2008,0,0,0,0,1,0,0,0,4,0,0,0,3,0,2,0,0,0,0,0,1,0,0,0,0,0,0
649,Mitt Romney,Mitt Romney,0,25,Address to the Detroit Economic Club,address,2008,2008,0,0,0,0,4,3,0,0,5,0,2,0,0,0,0,0,0,0,0,0,0,0,1,0,2,2,0
650,Mitt Romney,Mitt Romney,0,26,Remarks Following the Michigan Primary,remarks,2008,2008,0,0,0,0,0,0,0,0,1,0,0,0,0,0,1,0,0,0,0,0,0,0,0,0,0,0,0
651,Mitt Romney,Mitt Romney,0,27,Remarks Following the Nevada Caucuses,remarks,2008,2008,0,0,0,0,0,1,0,0,10,0,0,0,3,0,1,0,0,0,0,0,0,0,0,0,0,0,0
652,Mitt Romney,Mitt Romney,Coral Springs,28,"Excerpts of Remarks to the Media in Coral Springs, Florida",remarks,2008,2008,0,0,0,0,0,0,0,0,3,0,0,0,2,0,1,0,0,0,0,0,0,0,0,0,0,0,0
653,Mitt Romney,Mitt Romney,West Palm Beach,29,"Remarks to the Media in West Palm Beach, Florida",remarks,2008,2008,0,0,0,0,1,0,0,0,1,0,0,0,0,0,0,0,0,0,0,0,0,0,0,0,0,0,0
654,Mitt Romney,Mitt Romney,0,30,Remarks Following the Florida Primary,remarks,2008,2008,0,0,0,0,0,0,0,0,6,0,0,0,1,0,1,0,0,0,0,0,0,0,0,0,0,0,0
655,Mitt Romney,Mitt Romney,0,31,"Interview with George Stephanopoulos on ABC News' ""This Week""",interview,2008,2008,0,0,0,0,3,0,0,0,3,0,0,0,0,0,0,0,0,0,0,0,0,0,0,0,0,0,0
656,Mitt Romney,Mitt Romney,0,32,"Remarks Following the ""Super Tuesday"" Primaries and Caucuses",remarks,2008,2008,0,0,0,0,0,0,0,0,8,0,0,0,0,0,2,0,0,0,0,0,2,0,0,0,0,0,0
657,Mitt Romney,Mitt Romney,0,33,Remarks to the Conservative Political Action Conference Announcing the End of Presidential Campaign Activities,remarks,2008,2008,0,0,0,0,3,1,2,0,4,0,0,0,0,0,1,0,0,0,0,0,0,0,0,0,0,0,0
658,Mitt Romney,Mitt Romney,Saint Paul,34,Address at the Republican National Convention in Saint Paul,address,2008,2008,0,0,0,0,1,0,0,0,7,0,0,0,3,0,0,0,0,0,0,0,0,0,0,0,1,1,0
659,Joe Biden,Joe Biden,0,1,Remarks on the Senate Floor on the Bipartisan Iraq War Resolution,remarks,2008,2008,0,0,0,0,0,0,0,0,0,0,0,0,0,0,3,0,0,0,0,0,0,0,0,0,0,0,0
660,Joe Biden,Joe Biden,0,2,Remarks at the Brookings Institution on Iraq's Future and America's Interests,remarks,2008,2008,0,0,0,0,1,0,0,0,0,0,0,0,4,0,0,0,0,0,0,0,3,1,0,0,0,0,0
661,Joe Biden,Joe Biden,0,3,Opening Statement in the Senate Foreign Relations Committee Hearing on Afghanistan,others,2008,2008,0,0,0,0,0,0,0,0,0,0,0,0,1,0,2,0,0,0,0,0,0,0,0,0,0,0,0
662,Joe Biden,Joe Biden,0,4,Remarks at the Drake University School of Law,remarks,2008,2008,0,0,0,0,0,0,0,0,0,0,0,0,0,0,2,0,0,0,0,0,4,0,0,0,0,0,0
663,Joe Biden,Joe Biden,0,5,"Interview with Tim Russert on NBC News' ""Meet the Press""",interview,2008,2008,0,0,0,0,0,3,0,0,0,0,0,0,0,0,5,0,0,0,0,0,2,0,0,0,0,0,0
664,Joe Biden,Joe Biden,Washington,6,"Remarks at the Financial Times/SAIS Forum on Iraq in Washington, DC",remarks,2008,2008,0,0,0,0,0,0,0,0,0,0,0,0,0,0,0,0,0,0,0,0,9,3,0,0,0,0,0
665,Joe Biden,Joe Biden,0,7,Remarks in Advance of Bush Address on Iraq,remarks,2008,2008,0,0,0,0,0,0,0,0,0,0,0,0,0,0,0,0,0,0,0,0,4,1,0,0,0,0,0
666,Joe Biden,Joe Biden,Iowa,8,"Remarks at the Harkin Steak Fry in Indianola, Iowa",remarks,2008,2008,0,0,0,0,0,0,0,0,0,0,0,0,1,0,1,0,0,0,0,0,2,0,0,0,0,0,0
667,Joe Biden,Joe Biden,Manchester,9,"Remarks at Saint Anselm's College in Manchester, New Hampshire: ""A New Approach to Pakistan""",remarks,2008,2008,0,0,0,0,0,0,0,0,1,0,0,0,0,0,2,0,0,0,0,0,0,0,0,0,0,0,0
668,Joe Biden,Joe Biden,Portsmouth,10,"Excerpts of Remarks in Portsmouth, New Hampshire",remarks,2008,2008,0,0,0,0,0,0,0,0,0,0,0,0,0,0,0,0,0,0,0,0,0,0,0,0,0,0,0
669,Joe Biden,Joe Biden,Virginia,11,"Remarks at the DNC Fall Meeting in Tyson's Corner, Virginia",remarks,2008,2008,0,0,0,0,0,0,0,0,0,0,0,0,0,0,1,0,0,0,0,0,1,0,0,0,0,0,0
670,Joe Biden,Joe Biden,0,12,Remarks at the Democratic National Committee's Winter Meeting,remarks,2008,2008,0,0,0,0,0,0,0,0,0,0,0,0,0,0,0,0,0,0,0,0,0,0,0,0,0,0,0
671,Mike Huckabee,Mike Huckabee,0,1,"Interview with George Stephanopoulos on ABC News' ""This Week""",interview,2008,2008,0,0,0,0,0,0,0,0,0,0,0,0,3,0,0,0,0,0,0,0,1,1,0,0,0,0,0
672,Mike Huckabee,Mike Huckabee,0,2,"Interview with Bob Schieffer on CBS News' ""Face the Nation""",interview,2008,2008,0,0,0,0,0,1,0,0,0,0,0,0,1,0,1,0,0,0,0,0,0,0,0,0,0,0,0
673,Mike Huckabee,Mike Huckabee,0,3,"Interview with Jim Axelrod on CBS News' ""Face the Nation""",interview,2008,2008,0,0,0,0,0,0,0,0,0,0,0,0,1,0,2,0,0,0,0,0,0,0,0,0,0,0,0
674,Mike Huckabee,Mike Huckabee,0,4,"Interview with Tim Russert on NBC News' ""Meet the Press""",interview,2008,2008,0,0,0,0,0,0,0,0,3,0,0,0,0,0,8,0,0,0,1,0,3,0,0,0,1,1,0
675,Mike Huckabee,Mike Huckabee,0,5,Remarks Following the Iowa Caucuses,remarks,2008,2008,0,0,0,0,0,0,0,0,0,0,0,0,0,0,2,0,0,0,0,0,0,0,0,0,0,0,0
676,Mike Huckabee,Mike Huckabee,0,6,Remarks Following the New Hampshire Primary,remarks,2008,2008,0,0,0,0,0,0,0,0,0,0,0,0,1,0,0,0,0,0,0,0,0,0,0,0,0,0,0
677,Mike Huckabee,Mike Huckabee,0,7,"Interview with Bob Schieffer on CBS News' ""Face the Nation""",interview,2008,2008,0,0,0,0,0,1,0,0,6,0,4,0,0,0,1,0,0,0,0,0,0,0,0,0,2,2,0
678,Mike Huckabee,Mike Huckabee,0,8,Remarks Following the Michigan Primary,remarks,2008,2008,0,0,0,0,0,0,0,0,1,0,0,0,0,0,1,0,0,0,0,0,2,0,0,0,0,0,0
679,Mike Huckabee,Mike Huckabee,0,9,Remarks Following the South Carolina Primary,remarks,2008,2008,0,0,0,0,0,0,0,0,0,0,0,0,0,0,0,0,0,0,0,0,0,0,0,0,0,0,0
680,Mike Huckabee,Mike Huckabee,0,10,Remarks Following the Florida Primary,remarks,2008,2008,0,0,0,0,0,0,0,0,0,0,0,0,0,0,1,0,0,0,0,0,0,0,0,0,0,0,0
681,Mike Huckabee,Mike Huckabee,0,11,"Remarks Following the ""Super Tuesday"" Primaries and Caucuses",remarks,2008,2008,0,0,0,0,0,0,0,0,0,0,0,0,0,0,3,0,0,0,0,0,0,0,0,0,0,0,0
682,Mike Huckabee,Mike Huckabee,0,12,Remarks to the Conservative Political Action Conference,remarks,2008,2008,0,0,0,0,0,1,1,0,1,0,0,0,2,0,1,0,0,0,0,0,2,0,0,0,1,1,0
683,Mike Huckabee,Mike Huckabee,Maryland,13,"Remarks Following the Maryland, Virginia, and District of Columbia Primaries",remarks,2008,2008,0,0,0,0,0,0,0,0,0,0,0,0,0,0,1,0,0,0,0,0,0,0,0,0,0,0,0
684,Mike Huckabee,Mike Huckabee,Texas,14,"Remarks Conceding the Republican Presidential Nomination Following the Ohio, Rhode Island, Texas, and Vermont Primaries",remarks,2008,2008,0,0,0,0,0,1,1,0,0,0,0,0,0,0,6,0,0,0,0,0,0,0,0,0,0,0,0
685,Mike Huckabee,Mike Huckabee,Saint Paul,15,Address at the Republican National Convention in Saint Paul,address,2008,2008,0,0,0,0,0,0,0,0,0,0,0,0,0,0,0,0,0,0,0,0,0,0,0,0,0,0,0
686,Scott Walker,Scott Walker,Waukesha,1,"Remarks Announcing Candidacy for President in Waukesha, Wisconsin",remarks,2016,2016,0,0,0,0,1,0,0,0,5,0,0,0,8,0,3,0,0,0,0,0,3,0,0,0,0,0,0
687,Scott Walker,Scott Walker,Madison,2,"Remarks in Madison, Wisconsin Announcing the End of Presidential Campaign Activities",remarks,2016,2016,0,0,0,0,0,0,0,0,1,0,0,0,1,0,3,0,0,0,0,0,1,0,0,0,0,0,0
688,Scott Walker,Scott Walker,Cleveland,3,"Remarks to the Republican National Convention in Cleveland, Ohio",remarks,2016,2016,0,0,0,0,0,0,0,0,0,0,0,0,0,0,0,0,0,0,1,0,0,0,0,0,1,1,0
689,Ben Carson,Ben Carson,Detroit,1,"Remarks Announcing Candidacy for President in Detroit, Michigan",remarks,2016,2016,0,0,0,0,0,0,0,0,4,0,0,0,0,0,0,0,0,0,0,0,2,0,0,0,3,3,0
690,Ben Carson,Ben Carson,Cleveland,2,"Remarks to the Republican National Convention in Cleveland, Ohio",remarks,2016,2016,0,0,0,0,0,0,0,0,0,0,0,0,1,0,1,0,0,0,0,0,0,0,0,0,0,0,0
691,Carly Fiorina,Carly Fiorina,0,1,Video Remarks Announcing Candidacy for President,remarks,2016,2016,0,0,0,0,0,0,0,0,0,0,0,0,0,0,0,0,0,0,0,0,0,0,0,0,0,0,0
692,Hillary Clinton,Hillary Clinton,0,1,Video Transcript: Presidential Exploratory Committee Announcement,others,2016,2016,0,0,0,0,0,0,0,0,0,0,0,0,0,0,0,0,0,0,0,0,2,0,0,0,0,0,0
693,Hillary Clinton,Hillary Clinton,0,2,"Remarks in a ""Let the Conversation Begin Webcast""",remarks,2016,2016,0,0,0,0,1,0,1,0,3,0,0,0,4,0,7,1,0,0,0,0,3,0,0,0,0,0,0
694,Hillary Clinton,Hillary Clinton,0,3,"Remarks in a ""Let the Conversation Begin Webcast""",remarks,2016,2016,0,0,0,0,2,0,0,0,1,0,0,0,1,0,3,0,0,0,0,0,5,1,0,0,0,0,0
695,Hillary Clinton,Hillary Clinton,0,4,"Remarks in a ""Let the Conversation Begin Webcast""",remarks,2016,2016,0,0,0,0,0,1,0,0,0,0,0,0,3,0,6,0,0,0,0,0,3,0,0,0,0,0,0
696,Hillary Clinton,Hillary Clinton,0,5,Senate Floor Speech on the War in Iraq,speech,2016,2016,0,0,0,0,0,0,0,0,0,0,0,0,0,0,2,0,0,0,0,0,1,1,0,0,0,0,0
697,Hillary Clinton,Hillary Clinton,0,6,Senate Floor Remarks: No Military Action On Iran Without Congressional Authority,remarks,2016,2016,0,0,0,0,0,1,0,0,0,0,0,0,0,0,1,0,0,0,0,0,1,0,0,0,0,0,0
698,Hillary Clinton,Hillary Clinton,Selma,7,"Remarks on the 42nd Anniversary of Bloody Sunday in Selma, Alabama",remarks,2016,2016,0,0,0,0,0,0,0,0,1,0,0,0,3,0,1,0,0,0,0,0,1,0,0,0,0,0,0
699,Hillary Clinton,Hillary Clinton,0,8,"Remarks in the ""Equal Pay HillCast""",remarks,2016,2016,0,0,0,0,0,1,0,0,0,0,0,0,1,0,2,0,0,0,0,0,1,0,0,0,0,0,0
700,Hillary Clinton,Hillary Clinton,0,9,"Excerpt from Hillary Clinton's Remarks at the New Hampshire Democratic Party's ""100 Club"" Dinner",remarks,2016,2016,0,0,0,0,0,0,0,0,0,0,0,0,0,0,0,0,0,0,0,0,1,0,0,0,0,0,0
701,Hillary Clinton,Hillary Clinton,Washington,10,"Remarks at the International Association of Fire Fighters Bipartisan 2008 Presidential Forum in Washington, DC",remarks,2016,2016,0,0,0,0,0,0,0,0,0,0,0,0,0,0,2,0,0,0,0,0,1,0,0,0,0,0,0
702,Hillary Clinton,Hillary Clinton,0,11,Speech on Subprime Lending,speech,2016,2016,0,0,0,0,0,0,0,0,5,0,0,0,2,0,4,0,0,0,0,0,1,0,0,0,0,0,0
703,Hillary Clinton,Hillary Clinton,Manchester,12,"Remarks on Government Reform at St. Anselm College in Manchester, New Hampshire",remarks,2016,2016,0,0,0,0,0,9,0,0,0,0,0,0,1,0,3,0,0,0,0,0,6,4,0,2,0,0,0
704,Hillary Clinton,Hillary Clinton,New Orleans,13,Speech at Dillard University in New Orleans,speech,2016,2016,0,0,0,0,0,0,0,0,0,0,0,0,1,0,0,0,0,0,0,0,3,2,0,0,0,0,0
705,Hillary Clinton,Hillary Clinton,Miami,14,Remarks in Miami on Expanding Pre-K,remarks,2016,2016,0,0,0,0,0,0,0,0,1,0,0,0,4,0,8,0,0,0,0,0,1,0,0,0,1,0,1
706,Hillary Clinton,Hillary Clinton,0,15,Remarks at the George Washington University on Reducing the Cost of Health Care,remarks,2016,2016,1,0,0,0,0,0,2,0,2,0,0,0,1,0,4,0,0,0,0,0,2,1,0,0,0,0,0
707,Hillary Clinton,Hillary Clinton,0,16,Remarks - Modern Progressive Vision: Shared Prosperity,remarks,2016,2016,1,0,0,0,4,6,3,0,18,1,0,0,12,0,6,0,0,0,0,0,2,0,0,1,6,6,0
708,Hillary Clinton,Hillary Clinton,0,17,Hillary Clinton Speech and Q&A on Innovation,speech,2016,2016,0,0,0,0,2,1,2,0,10,1,0,0,2,0,7,0,0,0,0,0,4,2,0,0,1,1,0
709,Hillary Clinton,Hillary Clinton,Washington,18,"Remarks at the Center for a New American Security in Washington, DC",remarks,2016,2016,0,0,0,0,5,0,0,0,0,0,0,0,3,0,5,0,0,0,0,0,3,2,0,0,0,0,0
710,Hillary Clinton,Hillary Clinton,Temple,19,"Speech at the Temple for the Performing Arts in Des Moines, Iowa",speech,2016,2016,2,1,0,0,0,0,0,0,1,1,0,0,0,0,4,0,0,0,0,0,2,0,0,0,0,0,0
711,Hillary Clinton,Hillary Clinton,Portsmouth,20,"Speech in Portsmouth, New Hampshire on the Green Building Fund",speech,2016,2016,0,0,0,1,3,0,0,0,4,0,0,0,3,0,4,0,0,0,0,0,1,0,0,0,0,0,0
712,Hillary Clinton,Hillary Clinton,0,21,Remarks to the Urban League,remarks,2016,2016,0,0,0,0,0,1,0,0,1,0,0,0,2,0,3,0,0,0,0,0,0,0,0,0,0,0,0
713,Hillary Clinton,Hillary Clinton,0,22,Speech on Housing and the Mortgage Crisis,speech,2016,2016,0,0,0,0,0,0,0,0,11,0,0,0,2,0,4,0,0,0,0,0,1,0,0,0,0,0,0
714,Hillary Clinton,Hillary Clinton,0,23,Remarks on Infrastructure,remarks,2016,2016,1,0,0,1,1,1,0,0,10,0,0,0,5,0,1,0,0,0,0,0,3,0,0,0,0,0,0
715,Hillary Clinton,Hillary Clinton,Iowa,24,"Remarks in Waukee, Iowa on Long-Term Care Insurance",remarks,2016,2016,0,0,0,0,1,2,0,0,0,1,0,0,4,0,4,0,0,0,0,0,9,2,0,0,0,0,0
716,Hillary Clinton,Hillary Clinton,0,25,Speech to the Veterans of Foreign Wars,speech,2016,2016,0,0,0,0,1,0,0,0,0,0,0,0,0,0,2,0,0,0,0,0,1,0,0,0,0,0,0
717,Hillary Clinton,Hillary Clinton,0,26,"Speech at the Dartmouth-Hitchcock Medical Center in Lebanon, New Hampshire",speech,2016,2016,2,0,0,0,0,2,0,0,1,0,0,0,0,0,1,0,0,0,0,0,2,1,0,0,0,0,0
718,Hillary Clinton,Hillary Clinton,Charleston,27,"Remarks to the NAACP in Charleston, South Carolina",remarks,2016,2016,0,0,0,0,1,3,0,0,3,0,0,0,2,0,5,0,0,0,1,0,2,1,0,0,0,0,0
719,Hillary Clinton,Hillary Clinton,Des Moines,28,"Remarks in Des Moines, Iowa on American Health Choices Plan",remarks,2016,2016,0,0,0,0,0,5,1,0,3,0,0,0,2,0,5,0,0,0,0,0,1,0,0,0,0,0,0
720,Hillary Clinton,Hillary Clinton,Washington,29,"Remarks at the Carnegie Institution for Science in Washington, DC",remarks,2016,2016,0,0,0,0,1,3,2,0,6,2,0,0,0,0,4,0,0,0,0,0,3,1,0,0,0,0,0
721,Hillary Clinton,Hillary Clinton,0,30,Remarks on Economic Blueprint for the 21st Century,remarks,2016,2016,5,4,0,0,7,1,3,0,28,0,2,0,19,0,3,0,0,0,1,4,3,2,0,0,0,0,0
722,Hillary Clinton,Hillary Clinton,Iowa,31,"Remarks in Webster City, Iowa",remarks,2016,2016,0,0,0,0,0,0,0,0,3,0,0,0,2,0,4,0,0,0,0,0,1,1,0,0,0,0,0
723,Hillary Clinton,Hillary Clinton,Plymouth,32,"Speech on College Affordability at Plymouth State University in Plymouth, New Hampshire",speech,2016,2016,0,0,0,0,3,2,0,0,6,1,0,0,3,0,8,0,0,0,1,0,2,0,0,0,0,0,0
724,Hillary Clinton,Hillary Clinton,Manchester,33,"Remarks in Manchester, New Hampshire on Helping Parents Balance Work & Family",remarks,2016,2016,0,0,0,0,0,0,0,0,4,0,0,0,0,0,7,0,0,0,0,0,1,0,0,0,1,1,0
725,Hillary Clinton,Hillary Clinton,Ames,34,Mary Louise Smith Lecture at the Catt Center for Women and Politics at Iowa State University in Ames,others,2016,2016,0,0,0,0,0,1,0,0,2,0,0,0,1,0,2,0,0,0,0,0,0,0,0,0,0,0,0
726,Hillary Clinton,Hillary Clinton,0,35,Remarks on Student Activism at Wellesley College,remarks,2016,2016,0,0,0,0,0,1,1,0,0,0,0,0,3,0,1,0,0,0,0,0,1,0,0,0,0,0,0
727,Hillary Clinton,Hillary Clinton,Manchester,36,"Remarks at the Granite State Independent Living Forum in Manchester, New Hampshire",remarks,2016,2016,0,0,0,0,0,1,0,0,0,0,0,0,2,0,2,0,0,0,0,0,0,0,0,0,0,0,0
728,Hillary Clinton,Hillary Clinton,0,37,Remarks on Comprehensive Strategy to Address the Climate and Energy Challenge,remarks,2016,2016,0,0,0,2,3,0,0,0,15,2,0,0,3,0,4,0,0,0,0,0,1,0,0,0,0,0,1
729,Hillary Clinton,Hillary Clinton,Des Moines,38,Remarks at the Iowa Jefferson-Jackson Dinner in Des Moines,remarks,2016,2016,0,0,0,0,1,1,0,0,2,0,0,0,1,0,0,1,0,0,0,0,2,0,0,0,0,0,0
730,Hillary Clinton,Hillary Clinton,0,39,Remarks via Satellite to the National Congress of American Indians Annual Convention,remarks,2016,2016,0,0,0,0,0,0,0,0,0,0,0,0,0,0,1,0,0,0,0,0,0,0,0,0,0,0,0
731,Hillary Clinton,Hillary Clinton,Knoxville,40,"Policy Address in Knoxville, Iowa on America's Economic Challenges",address,2016,2016,1,1,0,0,5,2,0,0,25,0,0,0,6,0,2,0,0,0,0,0,2,1,0,0,3,2,1
732,Hillary Clinton,Hillary Clinton,Sioux City,41,"Remarks at the Autism Event with Sally Pederson in Sioux City, Iowa",remarks,2016,2016,0,0,0,0,0,0,0,0,0,0,0,0,4,0,0,0,0,0,0,0,0,0,0,0,0,0,0
733,Hillary Clinton,Hillary Clinton,0,42,Excerpts of Remarks on Health Care,remarks,2016,2016,0,0,0,0,0,0,0,0,0,0,0,0,0,0,2,0,0,0,0,0,0,0,0,0,0,0,0
734,Hillary Clinton,Hillary Clinton,Lake Forest,43,"Remarks at the Global Summit on AIDS and the Church at Saddleback Church in Lake Forest, California",remarks,2016,2016,0,0,0,0,0,0,0,0,3,0,0,0,2,0,3,0,0,0,0,0,1,0,0,0,0,0,0
735,Hillary Clinton,Hillary Clinton,Iowa,44,"Excerpt of Remarks in Clear Lake, Iowa",remarks,2016,2016,0,0,0,0,0,0,0,0,1,0,0,0,0,0,1,0,0,0,0,0,2,0,0,0,0,0,0
736,Hillary Clinton,Hillary Clinton,0,45,Remarks on Wall Street on Housing Crisis,remarks,2016,2016,1,0,0,0,0,0,0,0,19,0,0,0,5,0,2,0,0,0,0,0,2,1,0,0,0,0,0
737,Hillary Clinton,Hillary Clinton,Council Bluffs,46,"Remarks at the Every County Counts Kickoff in Council Bluffs, Iowa",remarks,2016,2016,0,0,0,0,1,1,0,0,3,0,0,0,3,0,7,0,0,0,1,0,3,0,0,0,0,0,0
738,Hillary Clinton,Hillary Clinton,Johnston,47,"Remarks at the The Hillary I Know Event in Johnston, Iowa",remarks,2016,2016,0,0,0,0,0,1,0,0,2,0,0,0,1,0,5,0,0,0,0,0,2,0,0,0,0,0,0
739,Hillary Clinton,Hillary Clinton,0,48,Remarks Following the Iowa Caucuses,remarks,2016,2016,0,0,0,0,0,0,0,0,0,0,0,0,0,0,3,0,0,0,0,0,0,0,0,0,0,0,0
740,Hillary Clinton,Hillary Clinton,Milford,49,Remarks at the New Hampshire Democratic Party 100 Club Dinner in Milford,remarks,2016,2016,0,0,0,0,0,0,0,0,5,0,0,0,0,0,2,0,0,0,0,0,0,0,0,0,2,2,0
741,Hillary Clinton,Hillary Clinton,0,50,Remarks Following the New Hampshire Primary,remarks,2016,2016,0,0,0,0,0,0,0,0,0,0,0,0,1,0,1,0,0,0,0,0,0,0,0,0,0,0,0
742,Hillary Clinton,Hillary Clinton,0,51,Remarks on an Economic Stimulus Plan,remarks,2016,2016,1,0,0,0,0,0,0,0,11,0,0,0,3,0,1,0,0,0,0,0,0,0,0,0,1,1,0
743,Hillary Clinton,Hillary Clinton,0,52,"Interview with Tim Russert on NBC News' ""Meet the Press""",interview,2016,2016,0,0,0,3,0,0,0,0,5,0,0,0,0,0,9,0,0,0,0,0,0,0,0,0,0,0,0
744,Hillary Clinton,Hillary Clinton,New York City,53,"Remarks at SEIU 32BJ Event Honoring the Legacy of Martin Luther King, Jr. in New York City",remarks,2016,2016,0,0,0,0,0,0,0,0,1,0,0,0,0,0,3,0,0,0,0,0,0,0,0,0,0,0,0
745,Hillary Clinton,Hillary Clinton,0,54,Remarks Following the Nevada Caucuses,remarks,2016,2016,0,0,0,0,0,0,0,0,1,0,0,0,0,0,0,0,0,0,0,0,0,0,0,0,0,0,0
746,Hillary Clinton,Hillary Clinton,0,55,Remarks to Reporters on the Global Economic Crisis,remarks,2016,2016,0,0,0,0,0,1,0,0,3,0,0,0,0,0,1,0,0,0,0,0,0,0,0,0,0,0,0
747,Hillary Clinton,Hillary Clinton,0,56,Remarks on Solutions for the American Economy,remarks,2016,2016,2,0,0,0,5,0,0,0,30,0,0,0,4,0,1,0,0,0,0,0,0,0,0,0,4,4,0
748,Hillary Clinton,Hillary Clinton,0,57,Remarks Following the South Carolina Primary,remarks,2016,2016,0,0,0,0,0,0,0,0,1,0,0,0,0,0,1,0,0,0,0,0,0,0,0,0,0,0,0
749,Hillary Clinton,Hillary Clinton,0,58,"Interview with Bob Schieffer on CBS News' ""Face the Nation""",interview,2016,2016,0,0,0,0,0,0,0,0,2,0,0,0,0,0,3,0,0,0,0,0,0,0,0,0,1,1,0
750,Hillary Clinton,Hillary Clinton,Union,59,"Remarks Before the State of the Union in Hartford, Connecticut",remarks,2016,2016,0,0,0,0,1,2,2,0,1,1,0,0,1,0,3,0,0,0,0,0,0,0,0,0,0,0,0
751,Hillary Clinton,Hillary Clinton,0,60,Remarks Following the Florida Primary,remarks,2016,2016,0,0,0,0,0,0,0,0,1,0,0,0,0,0,1,0,0,0,0,0,0,0,0,0,0,0,0
752,Hillary Clinton,Hillary Clinton,Atlanta,61,Remarks at Baptist Convention in Atlanta,remarks,2016,2016,0,0,0,0,0,0,0,0,1,0,0,0,0,0,0,0,0,0,0,0,0,0,0,0,0,0,0
