,Author,Author1,City,No.,Title,Type,Year,Year1,adjust,adjustment,anti-dumping,cheap,china,compete,competition,dumping,economy,export,free trade,free trade agreeement,grow,growthmanufacturingworld,import,labor union,liberalization,liberalizelabor,mexico,nafta,protect,protection,rust belt,subsidy,unemploy,unemployment,wto
1034,Donald J. Trump,Donald J. Trump,Charlotte,64,"Remarks at McGlohon Theatre at Spirit Square in Charlotte, North Carolina",remarks,2016,2016,0,0,0,0,2,0,0,0,0,0,0,0,1,0,0,0,0,0,2,3,1,1,0,0,0,0,0
1035,Donald J. Trump,Donald J. Trump,Springfield,65,"Remarks at the Champions Center Expo in Springfield, Ohio",remarks,2016,2016,0,0,0,0,2,0,0,0,0,0,0,0,0,0,6,0,0,0,6,5,0,0,0,0,1,1,0
1036,Donald J. Trump,Donald J. Trump,Manchester,66,"Remarks at Radisson Armory in Manchester, New Hampshire",remarks,2016,2016,0,0,0,0,4,0,0,0,0,0,0,0,5,0,3,0,0,0,6,3,0,0,0,0,0,0,0
1037,Donald J. Trump,Donald J. Trump,Golden,67,"Remarks at the Jeffco Fairgrounds Event Center in Golden, Colorado",remarks,2016,2016,0,0,0,0,0,0,0,0,0,0,0,0,0,0,0,0,0,0,0,0,1,0,0,0,0,0,0
1038,Donald J. Trump,Donald J. Trump,Phoenix,68,"Remarks at the Phoenix Convention Center in Phoenix, Arizona",remarks,2016,2016,0,0,0,0,2,0,0,0,0,0,0,0,0,0,0,0,0,0,0,3,2,0,0,0,0,0,0
1039,Donald J. Trump,Donald J. Trump,Warren,69,"Remarks at Macomb Community College South Campus in Warren, Michigan",remarks,2016,2016,0,0,0,0,3,0,0,0,0,0,0,0,1,0,2,0,0,0,7,4,1,0,0,0,1,1,0
1040,Donald J. Trump,Donald J. Trump,0,70,"Remarks on Obamacare in Valley Forge, Pennsylvania",remarks,2016,2016,0,0,0,0,2,0,0,2,1,0,0,0,0,0,4,0,0,0,1,2,0,0,0,1,0,0,0
1041,Donald J. Trump,Donald J. Trump,Orlando,71,"Remarks at the Central Florida Fairgrounds in Orlando, Florida",remarks,2016,2016,0,0,0,0,1,0,0,1,0,0,0,0,0,0,3,0,0,0,2,2,0,0,0,1,0,0,0
1042,Donald J. Trump,Donald J. Trump,Miami,72,"Remarks at the Bayfront Park Amphitheater in Miami, Florida",remarks,2016,2016,0,0,0,0,3,0,0,1,0,0,0,0,0,0,1,0,0,0,1,2,2,0,0,1,0,0,0
1043,Donald J. Trump,Donald J. Trump,Raleigh,73,"Remarks at J.S Dorton Arena in Raleigh, North Carolina",remarks,2016,2016,0,0,0,0,4,1,0,0,0,0,0,0,0,0,2,0,0,0,8,2,4,0,0,0,0,0,0
1044,Donald J. Trump,Donald J. Trump,0,74,Remarks in New York City Accepting Election as the 45th President of the United States,remarks,2016,2016,0,0,0,0,0,0,0,0,1,0,0,0,2,0,1,0,0,0,0,0,0,0,0,0,0,0,0
1045,Bernie Sanders,Bernie Sanders,0,1,Interview with Ed Schultz of MSNBC Regarding Statement of Presidential Candidacy,interview,2016,2016,0,0,0,0,2,1,0,0,1,0,0,0,0,0,2,0,0,0,0,1,0,0,0,0,3,3,0
1046,Bernie Sanders,Bernie Sanders,0,2,Interview with Wolf Blitzer of CNN Regarding Statement of Presidential Candidacy,interview,2016,2016,0,0,0,0,1,2,0,0,0,0,0,0,0,0,1,0,0,0,0,0,0,0,0,0,2,2,0
1047,Bernie Sanders,Bernie Sanders,0,3,Interview with Andrea Mitchell of MSNBC Regarding Statement of Presidential Candidacy,interview,2016,2016,0,0,0,0,1,0,0,0,1,0,0,0,0,0,1,0,0,0,0,0,0,0,0,0,0,0,0
1048,Bernie Sanders,Bernie Sanders,0,4,"Interview with Chris Cuomo of CNN's ""New Day""",interview,2016,2016,1,1,0,0,0,1,0,0,1,0,0,0,0,0,0,0,0,0,0,0,0,0,0,0,1,1,0
1049,Bernie Sanders,Bernie Sanders,0,5,Interview with Andrea Mitchell of MSNBC,interview,2016,2016,0,0,0,0,3,0,0,0,0,1,2,0,1,0,0,0,0,0,1,0,2,1,0,0,0,0,0
1050,Bernie Sanders,Bernie Sanders,Burlington,6,"Remarks Announcing Candidacy for President in Burlington, Vermont",remarks,2016,2016,0,0,0,0,1,0,0,0,6,0,0,0,0,0,1,0,0,0,0,0,2,0,0,0,3,3,0
1051,Bernie Sanders,Bernie Sanders,0,7,Interview with John Harwood of CNBC,interview,2016,2016,0,0,0,0,0,0,0,0,1,0,0,0,0,0,0,0,0,0,0,0,0,0,0,0,0,0,0
1052,Bernie Sanders,Bernie Sanders,0,8,News Conference by Senator Bernie Sanders and Representative Marcy Kaptur on Legislation to Restore Pension Guarantees for Thousands of Retired Union Workers,others,2016,2016,0,0,0,0,0,0,0,0,2,0,0,0,0,0,5,0,0,0,0,0,11,1,0,0,0,0,0
1053,Bernie Sanders,Bernie Sanders,Las Vegas,9,"Remarks at the National Association of Latino Elected and Appointed Officials Conference in Las Vegas, Nevada",remarks,2016,2016,0,0,0,0,0,1,0,0,6,0,1,0,2,0,1,0,0,0,2,4,2,1,0,0,3,3,0
1054,Bernie Sanders,Bernie Sanders,Baton Rouge,10,"Remarks at the Southern Christian Leadership Conference in Baton Rouge, Louisiana",remarks,2016,2016,0,0,0,0,2,0,0,0,6,0,0,0,2,0,2,0,0,0,1,0,3,0,0,0,7,7,0
1055,Bernie Sanders,Bernie Sanders,0,11,"Remarks with Joseph Stiglitz, James Galbraith, and Stephanie Kelton in a Discussion on the Greek Debt Crisis",remarks,2016,2016,3,1,0,0,0,0,0,0,30,1,0,0,13,0,26,0,0,0,0,0,1,0,0,0,15,14,0
1056,Bernie Sanders,Bernie Sanders,Oakland,12,"Remarks at National Nurses United Endorsement in Oakland, California",remarks,2016,2016,0,0,0,0,0,0,0,0,1,0,0,0,1,0,1,0,0,0,0,0,1,0,0,0,0,0,0
1057,Bernie Sanders,Bernie Sanders,Des Moines,13,Remarks at the Iowa State Fair in Des Moines,remarks,2016,2016,0,0,0,0,2,0,0,0,2,0,0,0,0,0,0,0,0,0,0,0,0,0,0,0,0,0,0
1058,Bernie Sanders,Bernie Sanders,Las Vegas,14,Remarks at the Nevada State AFL-CIO Constitutional Convention in Las Vegas,remarks,2016,2016,0,0,0,0,5,0,0,0,5,0,4,0,0,0,1,0,0,0,3,2,2,0,0,0,4,4,0
1059,Bernie Sanders,Bernie Sanders,Minneapolis,15,"Remarks at the Democratic National Committee Summer Meeting in Minneapolis, Minnesota",remarks,2016,2016,0,0,0,0,0,0,0,0,2,0,0,0,0,0,1,0,0,0,0,0,1,1,0,0,2,2,0
1060,Bernie Sanders,Bernie Sanders,Lynchburg,16,"Remarks at the Liberty University Convocation in Lynchburg, Virginia",remarks,2016,2016,0,0,0,0,0,0,0,0,3,0,0,0,0,0,3,0,0,0,0,0,0,0,0,0,2,1,0
1061,Bernie Sanders,Bernie Sanders,Manchester,17,Remarks at the New Hampshire Democratic Party Convention in Manchester,remarks,2016,2016,0,0,0,0,1,0,0,0,2,0,0,0,0,0,0,0,0,0,0,0,1,1,0,0,2,2,0
1062,Bernie Sanders,Bernie Sanders,0,18,Interview with Dana Bash of CNN,interview,2016,2016,0,0,0,0,0,0,0,0,1,0,0,0,0,0,1,0,0,0,0,0,0,0,0,0,0,0,0
1063,Bernie Sanders,Bernie Sanders,0,19,"Interview with Chris Matthews of MSNBC's ""Hardball""",interview,2016,2016,0,0,0,0,0,0,0,0,0,0,0,0,0,0,0,0,0,0,0,0,0,0,0,0,0,0,0
1064,Bernie Sanders,Bernie Sanders,Des Moines,20,Remarks at the Iowa Democratic Party Jefferson-Jackson Dinner in Des Moines,remarks,2016,2016,0,0,0,0,1,1,0,0,4,0,1,0,0,0,0,0,0,0,0,0,1,0,0,0,0,0,0
1065,Bernie Sanders,Bernie Sanders,Las Vegas,21,"Remarks at the Fair Immigration Reform Movement Strategy Summit in Las Vegas, Nevada",remarks,2016,2016,0,0,0,0,0,0,0,0,1,0,0,0,1,0,3,0,0,0,0,0,2,1,0,0,0,0,0
1066,Bernie Sanders,Bernie Sanders,Washington,22,"Remarks at Georgetown University in Washington, D.C.",remarks,2016,2016,2,0,0,0,2,1,2,0,10,0,0,0,3,0,7,0,0,0,2,0,5,0,0,0,5,3,0
1067,Bernie Sanders,Bernie Sanders,Manchester,23,Remarks at the New Hampshire Democratic Party Jefferson-Jackson Dinner in Manchester,remarks,2016,2016,1,1,0,0,0,0,0,0,4,0,0,0,0,0,2,0,0,0,0,0,1,0,0,0,1,1,0
1068,Bernie Sanders,Bernie Sanders,0,24,Interview with Andrea Mitchell of MSNBC,interview,2016,2016,0,0,0,0,0,0,0,0,1,0,0,0,0,0,3,0,0,0,0,0,2,0,0,0,0,0,0
1069,Bernie Sanders,Bernie Sanders,0,25,"Interview with Chris Cuomo of CNN's ""New Day""",interview,2016,2016,0,0,0,0,0,0,0,0,6,0,0,0,2,0,0,0,0,0,0,0,1,0,0,0,0,0,0
1070,Bernie Sanders,Bernie Sanders,0,26,"Interview with Martha Raddatz of ABC News' ""This Week""",interview,2016,2016,0,0,0,0,0,0,0,0,0,0,0,0,0,0,1,0,0,0,0,0,0,0,0,0,0,0,0
1071,Bernie Sanders,Bernie Sanders,New York City,27,Remarks on Wall Street and the Economy in New York City,remarks,2016,2016,0,0,0,0,0,0,0,0,15,0,0,0,2,0,1,0,0,0,1,0,1,1,0,0,1,1,0
1072,Bernie Sanders,Bernie Sanders,0,28,Interview with Thomas Roberts of MSNBC,interview,2016,2016,0,0,0,0,0,0,0,0,0,0,0,0,0,0,0,0,0,0,0,0,1,1,0,0,0,0,0
1073,Bernie Sanders,Bernie Sanders,0,29,"Interview with Chuck Todd of NBC News' ""Meet the Press""",interview,2016,2016,0,0,0,0,0,0,0,0,0,0,0,0,0,0,2,0,0,0,0,0,0,0,0,0,0,0,0
1074,Bernie Sanders,Bernie Sanders,0,30,"Remarks in Wolfeboro, New Hampshire",remarks,2016,2016,2,0,0,0,2,0,0,0,12,0,0,0,2,0,12,0,0,0,0,0,1,1,0,0,11,10,0
1075,Bernie Sanders,Bernie Sanders,Des Moines,31,"Remarks in a Meeting with Steelworkers in Des Moines, Iowa",remarks,2016,2016,1,1,0,0,5,2,0,0,2,0,0,0,2,0,6,0,0,0,1,2,1,0,0,0,0,0,0
1076,Bernie Sanders,Bernie Sanders,0,32,Remarks in Des Moines Following the Iowa Caucus,remarks,2016,2016,0,0,0,0,0,0,0,0,4,0,0,0,0,0,0,0,0,0,0,0,3,0,0,0,0,0,0
1077,Bernie Sanders,Bernie Sanders,0,33,Remarks in Concord Following the New Hampshire Primary,remarks,2016,2016,0,0,0,0,0,0,0,0,3,0,0,0,0,0,1,0,0,0,0,0,4,0,0,0,0,0,0
1078,Bernie Sanders,Bernie Sanders,0,34,"Interview with Chris Wallace of ""Fox News Sunday""",interview,2016,2016,0,0,0,0,0,0,0,0,2,0,0,0,0,0,1,0,0,0,0,0,0,0,0,0,1,1,0
1079,Bernie Sanders,Bernie Sanders,University,35,"Remarks with Chris Matthews at the MSNBC ""Hardball"" College Tour at the University of Chicago",remarks,2016,2016,0,0,0,0,1,0,0,0,2,0,0,0,1,0,12,0,0,0,0,0,2,0,0,0,2,2,0
1080,Bernie Sanders,Bernie Sanders,0,36,"Interview with Chuck Todd of NBC News' ""Meet the Press""",interview,2016,2016,0,0,0,0,0,0,0,0,0,0,0,0,0,0,2,0,0,0,0,0,0,0,0,0,0,0,0
1081,Bernie Sanders,Bernie Sanders,0,37,"Interview with George Stephanopoulos of ABC News' ""This Week""",interview,2016,2016,0,0,0,0,0,0,0,0,2,0,0,0,0,0,0,0,0,0,0,0,0,0,0,0,0,0,0
1082,Bernie Sanders,Bernie Sanders,0,38,"Remarks in Essex Junction, Vermont Following the ""Super Tuesday"" Primaries",remarks,2016,2016,0,0,0,0,0,0,0,0,1,0,0,0,0,0,0,0,0,0,0,0,0,0,0,0,0,0,0
1083,Bernie Sanders,Bernie Sanders,Miami,39,"Remarks in Miami, Florida Following the Michigan and Mississippi Democratic Primaries",remarks,2016,2016,0,0,0,0,0,0,0,0,1,0,0,0,0,0,0,0,0,0,0,0,0,0,0,0,0,0,0
1084,Bernie Sanders,Bernie Sanders,Salt Lake City,40,"Remarks on Policy in the Middle East in Salt Lake City, Utah",remarks,2016,2016,0,0,0,0,1,0,1,0,0,0,0,0,1,0,8,0,0,0,0,0,0,0,0,0,1,1,0
1085,Bernie Sanders,Bernie Sanders,0,41,"Interview with Chris Hayes of MSNBC's ""All In""",interview,2016,2016,0,0,0,0,2,0,0,0,1,0,0,0,1,0,1,0,0,0,0,0,1,0,0,0,0,0,0
1086,Bernie Sanders,Bernie Sanders,0,42,Interview with Erin Burnett of CNN,interview,2016,2016,0,0,0,0,1,0,0,0,7,0,0,0,0,0,2,0,0,0,1,0,2,0,0,0,0,0,0
1087,Bernie Sanders,Bernie Sanders,Madison,43,"Interview with Rachel Maddow of MSNBC in Madison, Wisconsin",interview,2016,2016,0,0,0,0,0,2,0,0,0,0,0,0,0,0,1,0,0,0,0,0,0,0,0,0,1,1,0
1088,Bernie Sanders,Bernie Sanders,0,44,Interview by The Daily News Editorial Board,interview,2016,2016,0,0,0,0,4,1,0,0,19,0,0,0,0,0,13,0,0,0,2,2,0,0,0,0,1,1,0
1089,Bernie Sanders,Bernie Sanders,Vatican City,45,Remarks at a Conference Hosted by the Pontifical Academy of Social Sciences in Vatican City,remarks,2016,2016,0,0,0,0,0,0,0,0,19,0,0,0,0,0,0,0,0,0,0,0,4,2,0,0,0,0,0
1090,Bernie Sanders,Bernie Sanders,0,46,"Interview with John Dickerson of CBS News' ""Face the Nation""",interview,2016,2016,0,0,0,0,0,0,0,0,1,0,0,0,0,0,0,0,0,0,0,0,0,0,0,0,0,0,0
1091,Bernie Sanders,Bernie Sanders,Union,47,"Interview with Dana Bash of CNN's ""State of the Union""",interview,2016,2016,0,0,0,0,0,0,0,0,2,0,0,0,0,0,2,0,0,0,0,0,0,0,0,0,0,0,0
1092,Bernie Sanders,Bernie Sanders,0,48,"Interview with Chris Cuomo of CNN's ""New Day""",interview,2016,2016,0,0,0,0,1,0,0,0,3,0,0,0,0,0,1,0,0,0,0,0,1,0,0,0,0,0,4
1093,Bernie Sanders,Bernie Sanders,0,49,"Interview with John Dickerson of CBS News' ""Face the Nation""",interview,2016,2016,0,0,0,0,0,0,0,0,1,0,0,0,0,0,0,0,0,0,0,0,0,0,0,0,0,0,0
1094,Bernie Sanders,Bernie Sanders,0,50,"Interview with Chuck Todd of NBC News' ""Meet the Press""",interview,2016,2016,0,0,0,0,0,0,0,0,0,0,0,0,0,0,5,0,0,0,0,0,0,0,0,0,0,0,0
1095,Bernie Sanders,Bernie Sanders,Union,51,"Interview with Jake Tapper of CNN's ""State of the Union""",interview,2016,2016,0,0,0,0,0,0,0,0,0,0,0,0,0,0,0,0,0,0,0,0,0,0,0,0,0,0,0
1096,Bernie Sanders,Bernie Sanders,Philadelphia,52,"Remarks in a Town Hall Meeting with Chris Hayes of MSNBC at the National Constitution Center in Philadelphia, Pennsylvania",remarks,2016,2016,0,0,0,0,3,0,0,0,0,0,0,0,0,0,8,0,0,0,1,1,2,0,0,0,2,2,0
1097,Bernie Sanders,Bernie Sanders,Huntington,53,"Remarks in Huntington, West Virginia Following the Connecticut, Rhode Island, Delaware, Maryland, and Pennsylvania Primaries",remarks,2016,2016,0,0,0,0,2,0,0,0,11,0,0,0,1,0,3,0,0,0,1,1,2,0,0,0,6,6,0
1098,Bernie Sanders,Bernie Sanders,0,54,"Interview on MSNBC's ""Morning Joe""",interview,2016,2016,0,0,0,0,0,0,0,0,1,0,0,0,0,0,4,0,0,0,0,0,1,0,0,0,0,0,0
1099,Bernie Sanders,Bernie Sanders,0,55,Interview with Chris Jansing of NBC News,interview,2016,2016,0,0,0,0,0,0,0,0,0,0,0,0,0,0,2,0,0,0,0,0,0,0,0,0,0,0,0
1100,Bernie Sanders,Bernie Sanders,0,56,Interview with Steve Inskeep of National Public Radio,interview,2016,2016,0,0,0,0,0,0,0,0,0,0,0,0,0,0,4,0,0,0,1,0,0,0,0,1,2,2,0
1101,Bernie Sanders,Bernie Sanders,0,57,Interview with Wolf Blitzer of CNN,interview,2016,2016,0,0,0,0,0,0,0,0,0,0,0,0,0,0,3,0,0,0,0,0,0,0,0,0,0,0,0
1102,Bernie Sanders,Bernie Sanders,0,58,Interview with Andrea Mitchell of MSNBC,interview,2016,2016,0,0,0,0,0,0,0,0,0,0,0,0,1,0,2,0,0,0,0,0,0,0,0,0,0,0,0
1103,Bernie Sanders,Bernie Sanders,Carson,59,"Remarks at a Campaign Rally in Carson, California",remarks,2016,2016,0,0,0,0,1,0,0,0,7,0,0,0,0,0,7,0,0,0,1,0,1,0,0,0,1,1,0
1104,Bernie Sanders,Bernie Sanders,Philadelphia,60,"Remarks to the Democratic National Convention in Philadelphia, Pennsylvania",remarks,2016,2016,0,0,0,0,0,0,0,0,2,0,1,0,0,0,1,0,0,0,0,0,1,0,0,0,0,0,0
1105,Bobby Jindal,Bobby Jindal,Kenner,1,"Remarks Announcing Candidacy for President in Kenner, Louisiana",remarks,2016,2016,0,0,0,1,0,0,0,0,4,0,0,0,4,0,0,0,0,0,0,0,2,0,0,0,0,0,0
1106,Chris Christie,Chris Christie,Livingston,1,"Remarks Announcing Candidacy for President in Livingston, New Jersey",remarks,2016,2016,0,0,0,0,0,0,0,0,3,0,0,0,4,0,0,0,0,0,0,0,0,0,0,0,0,0,0
1107,Chris Christie,Chris Christie,Cleveland,2,"Remarks to the Republican National Convention in Cleveland, Ohio",remarks,2016,2016,0,0,0,0,3,1,0,0,0,0,0,0,0,0,0,0,0,0,0,0,3,1,0,0,0,0,0
1108,George Pataki,George Pataki,Exeter,1,"Remarks Announcing Candidacy for President in Exeter, New Hampshire",remarks,2016,2016,0,0,0,0,0,0,0,0,0,0,0,0,5,0,1,0,0,0,0,0,5,0,0,0,0,0,0
1109,Jim Webb,Jim Webb,West Des Moines,1,"Remarks in RFD-TVs ""Rural Town Hall"" West Des Moines, Iowa",remarks,2016,2016,0,0,0,0,0,2,0,0,0,2,0,0,11,0,13,0,0,0,1,0,4,0,0,0,0,0,0
1110,Jeb Bush,Jeb Bush,Miami,1,"Remarks Announcing Candidacy for President at Miami Dade College in Miami, Florida",remarks,2016,2016,0,0,0,0,0,0,0,0,2,0,0,0,8,0,0,0,0,0,1,0,1,0,0,0,0,0,0
1111,Jeb Bush,Jeb Bush,Fort Lauderdale,2,"Remarks to the National Urban League Conference in Fort Lauderdale, Florida",remarks,2016,2016,0,0,0,0,0,0,0,0,2,0,0,0,8,0,0,0,0,0,0,0,0,0,0,0,0,0,0
1112,Jeb Bush,Jeb Bush,Simi Valley,3,"Remarks at the Ronald Reagan Presidential Library in Simi Valley, California",remarks,2016,2016,0,0,0,0,0,0,1,0,0,0,0,0,0,0,2,0,0,0,0,0,2,0,0,0,0,0,0
1113,Jeb Bush,Jeb Bush,Garner,4,"Remarks in Garner, North Carolina",remarks,2016,2016,0,0,0,0,1,3,1,0,6,0,0,0,12,0,0,0,0,0,0,0,2,1,0,0,0,0,0
1114,Jeb Bush,Jeb Bush,Tampa,5,"Remarks in Tampa, Florida",remarks,2016,2016,0,0,0,0,0,1,0,0,1,0,0,0,3,0,2,0,0,0,0,0,0,0,0,0,0,0,0
1115,Jeb Bush,Jeb Bush,Charleston,6,"Remarks at The Citadel in Charleston, South Carolina",remarks,2016,2016,0,0,0,0,2,0,0,0,0,0,0,0,2,0,0,0,0,0,0,0,7,0,0,0,0,0,0
1116,Jon Huntsman,Jon Huntsman,Jersey City,1,"Remarks Announcing Candidacy for President in Jersey City, New Jersey",remarks,2012,2012,0,0,0,0,0,0,0,0,1,0,0,0,3,0,3,0,0,0,0,0,1,0,0,0,1,1,0
1117,Jon Huntsman,Jon Huntsman,Manchester,2,Address at Southern New Hampshire University in Manchester,address,2012,2012,0,0,0,0,11,1,0,0,1,3,2,0,4,0,3,0,0,0,2,0,2,1,0,0,1,0,1
1118,Jon Huntsman,Jon Huntsman,Durham,3,"Remarks in Durham, New Hampshire",remarks,2012,2012,0,0,0,1,1,1,2,0,7,1,0,0,1,0,7,0,0,0,1,0,0,0,0,2,0,0,0
1119,Jon Huntsman,Jon Huntsman,Washington,4,"Remarks at the National Press Club in Washington, D.C.",remarks,2012,2012,0,0,0,0,0,0,2,0,3,0,0,0,2,0,0,0,0,0,0,0,3,0,0,1,1,0,0
1120,Jon Huntsman,Jon Huntsman,0,5,Remarks in Manchester Following the New Hampshire Primary,remarks,2012,2012,0,0,0,0,1,0,0,0,0,0,0,0,1,0,2,0,0,0,0,0,0,0,0,0,1,1,0
1121,Jon Huntsman,Jon Huntsman,Myrtle Beach,6,"Remarks in Myrtle Beach, South Carolina Announcing the End of Presidential Campaign Activities",remarks,2012,2012,0,0,0,0,1,0,0,0,1,0,0,0,0,0,1,0,0,0,0,0,1,0,0,0,0,0,0
1122,Herman Cain,Herman Cain,Atlanta,1,"Remarks Announcing Candidacy for President in Atlanta, Georgia",remarks,2012,2012,0,0,0,0,2,0,0,0,2,0,0,0,8,0,1,0,0,0,0,0,1,0,0,0,1,1,0
1123,Herman Cain,Herman Cain,Washington,2,"Remarks at the Values Voter Summit in Washington, D.C.",remarks,2012,2012,0,0,0,0,0,0,0,0,2,0,0,0,3,0,2,0,0,0,0,0,4,0,0,0,2,0,0
1124,Herman Cain,Herman Cain,Atlanta,3,"Remarks in Atlanta, Georgia Announcing the Suspension of Presidential Campaign Activities",remarks,2012,2012,0,0,0,0,0,0,0,0,0,0,0,0,1,0,1,0,0,0,0,0,0,0,0,0,0,0,0
1125,Ron Paul,Ron Paul,Exeter,1,"Remarks Announcing Candidacy for President in Exeter, New Hampshire",remarks,2012,2012,1,1,0,2,0,0,0,0,0,0,0,0,4,0,11,0,0,0,0,0,4,1,0,0,0,0,0
1126,Ron Paul,Ron Paul,Washington,2,"Remarks at the Values Voter Summit in Washington, D.C.",remarks,2012,2012,0,0,0,0,0,0,0,0,3,0,0,0,1,0,5,0,0,0,0,0,4,2,0,0,0,0,0
1127,Ron Paul,Ron Paul,Des Moines,3,Remarks at the Iowa Reagan Dinner in Des Moines,remarks,2012,2012,0,0,0,0,0,0,0,0,0,0,0,0,3,0,3,0,0,0,0,0,1,0,0,0,0,0,0
1128,Ron Paul,Ron Paul,Iowa,4,"Remarks in Anamosa, Iowa",remarks,2012,2012,0,0,0,0,3,0,0,0,2,0,0,0,5,0,3,0,0,0,0,0,6,0,0,0,0,0,0
1129,Ron Paul,Ron Paul,0,5,Remarks in Ankeny Following the Iowa Caucus,remarks,2012,2012,0,0,0,0,0,0,0,0,1,0,0,0,0,0,4,0,0,0,0,0,1,0,0,0,0,0,0
1130,Ron Paul,Ron Paul,0,6,Remarks in Manchester Following the New Hampshire Primary,remarks,2012,2012,0,0,0,0,0,0,0,0,2,0,0,0,2,0,2,0,0,0,0,0,2,1,0,0,0,0,0
1131,Ron Paul,Ron Paul,0,7,Remarks in Columbia Following the South Carolina Primary,remarks,2012,2012,0,0,0,0,0,0,0,0,1,0,0,0,7,0,1,0,0,0,0,0,0,0,0,0,1,1,0
1132,Ron Paul,Ron Paul,Henderson,8,"Remarks in Henderson, Nevada Following the Florida Primary",remarks,2012,2012,0,0,0,0,0,0,0,0,1,0,0,0,1,0,0,0,0,0,0,0,1,1,0,0,0,0,0
1133,Ron Paul,Ron Paul,0,9,"Remarks in Arden Hills, Minnesota Following the Nevada Caucuses",remarks,2012,2012,0,0,0,0,0,0,0,0,1,0,0,0,0,0,0,0,0,0,0,0,1,1,0,0,0,0,0
1134,Ron Paul,Ron Paul,0,10,Remarks Following the Maine Caucuses,remarks,2012,2012,0,0,0,0,0,0,0,0,1,0,0,0,2,0,4,0,0,0,0,0,0,0,0,0,0,0,0
1135,Ron Paul,Ron Paul,Fargo,11,"Remarks in Fargo, North Dakota Following the ""Super Tuesday"" Primaries and Caucuses",remarks,2012,2012,0,0,0,0,0,0,0,0,0,0,0,0,5,0,2,0,0,0,0,0,10,2,0,0,0,0,0
1136,Barack Obama,Barack Obama,Parma,1,"535 - Remarks at a Campaign Rally in Parma, Ohio",remarks,2012,2012,0,0,0,0,0,0,0,0,7,0,0,0,8,0,2,0,0,0,0,0,0,0,0,0,1,1,0
1137,Barack Obama,Barack Obama,Sandusky,2,"534 - Remarks at a Campaign Rally in Sandusky, Ohio",remarks,2012,2012,0,0,0,0,0,0,0,0,2,0,0,0,2,0,0,0,0,0,0,0,0,0,0,0,0,0,0
1138,Barack Obama,Barack Obama,0,3,"533 - Remarks at a Campaign Rally in Maumee, Ohio",remarks,2012,2012,0,0,0,0,2,1,2,0,9,0,0,0,2,0,0,0,0,0,0,0,1,0,0,0,0,0,0
1139,Barack Obama,Barack Obama,Pittsburgh,4,"537 - Remarks at a Campaign Rally in Pittsburgh, Pennsylvania",remarks,2012,2012,0,0,0,1,0,0,0,1,4,0,0,0,6,0,4,0,0,0,0,0,2,0,0,0,0,0,0
1140,Barack Obama,Barack Obama,0,5,"536 - Remarks at a Campaign Rally in Poland, Ohio",remarks,2012,2012,1,1,0,0,0,0,0,0,7,0,0,0,10,0,2,0,0,0,0,0,1,0,0,0,0,0,0
1141,Barack Obama,Barack Obama,Cedar Rapids,6,"545 - Remarks at a Campaign Rally in Cedar Rapids, Iowa",remarks,2012,2012,0,0,0,0,0,0,0,0,11,0,0,0,5,0,1,0,0,0,0,0,2,0,0,0,1,1,1
1142,Barack Obama,Barack Obama,Cedar Rapids,7,"544 - Remarks to an Overflow Crowd at Kirkwood Community College in Cedar Rapids, Iowa",remarks,2012,2012,0,0,0,0,0,0,0,0,0,0,0,0,1,0,0,0,0,0,0,0,0,0,0,0,0,0,0
1143,Barack Obama,Barack Obama,Hampton,8,"555 - Remarks at a Campaign Rally in Hampton, Virginia",remarks,2012,2012,0,0,0,0,0,1,0,0,12,0,0,0,8,0,2,0,0,0,0,0,3,0,0,0,0,0,0
1144,Barack Obama,Barack Obama,Roanoke,9,"556 - Remarks at a Campaign Rally in Roanoke, Virginia",remarks,2012,2012,0,0,0,0,0,0,0,0,12,0,0,0,11,0,1,0,0,0,0,0,0,0,0,0,0,0,0
1145,Barack Obama,Barack Obama,Virginia Beach,10,"554 - Remarks at a Campaign Rally in Virginia Beach, Virginia",remarks,2012,2012,0,0,0,0,0,0,0,0,9,0,0,0,8,0,1,0,0,0,0,0,0,0,0,0,0,0,0
1146,Barack Obama,Barack Obama,Clifton,11,"559 - Remarks at a Campaign Rally in Clifton, Virginia",remarks,2012,2012,0,0,0,0,1,0,0,0,9,0,0,0,5,0,2,0,0,0,0,0,0,0,0,0,0,0,0
1147,Barack Obama,Barack Obama,Virginia,12,"558 - Remarks at a Campaign Rally in Glen Allen, Virginia",remarks,2012,2012,0,0,0,0,0,0,0,0,8,0,0,0,2,0,1,0,0,0,0,0,2,0,0,0,0,0,0
1148,Barack Obama,Barack Obama,Cincinnati,13,"560 - Remarks at a Campaign Rally and a Question-and-Answer Session in Cincinnati, Ohio",remarks,2012,2012,0,0,0,2,0,0,0,0,18,0,0,0,12,0,18,0,0,0,0,0,4,1,0,0,10,9,0
1149,Barack Obama,Barack Obama,Austin,14,"566 - Remarks at a Campaign Rally in Austin, Texas",remarks,2012,2012,0,0,0,0,0,0,0,0,5,0,0,0,6,0,3,0,0,0,0,0,0,0,0,0,1,0,0
1150,Barack Obama,Barack Obama,San Antonio,15,"564 - Remarks at a Campaign Rally in San Antonio, Texas",remarks,2012,2012,0,0,0,0,0,0,0,0,6,0,0,0,4,0,2,0,0,0,0,0,1,0,0,0,0,0,0
1151,Barack Obama,Barack Obama,Jacksonville,16,"577 - Remarks at a Campaign Rally in Jacksonville, Florida",remarks,2012,2012,0,0,0,0,1,0,0,0,2,0,0,0,1,0,0,0,0,0,0,0,1,0,0,0,0,0,0
1152,Barack Obama,Barack Obama,West Palm Beach,17,"578 - Remarks at a Campaign Rally in West Palm Beach, Florida",remarks,2012,2012,0,0,0,0,0,0,0,0,6,0,0,0,1,0,4,0,0,0,0,0,5,0,0,0,0,0,0
1153,Barack Obama,Barack Obama,Oakland,18,"589 - Remarks at a Campaign Rally in Oakland, California",remarks,2012,2012,0,0,0,0,1,0,0,0,9,0,0,0,4,0,3,0,0,0,0,0,0,0,0,0,0,0,0
1154,Barack Obama,Barack Obama,Portland,19,"591 - Remarks at a Campaign Rally in Portland, Oregon",remarks,2012,2012,0,0,0,0,0,0,0,0,15,0,0,0,13,0,1,0,0,0,0,0,0,0,0,0,0,0,0
1155,Barack Obama,Barack Obama,New Orleans,20,"596 - Remarks at a Campaign Rally in New Orleans, Louisiana",remarks,2012,2012,0,0,0,0,0,0,0,0,6,0,0,0,7,0,2,0,0,0,0,0,0,0,0,0,0,0,0
1156,Barack Obama,Barack Obama,Akron,21,"611 - Remarks at a Campaign Rally in Akron, Ohio",remarks,2012,2012,0,0,0,0,0,0,0,0,5,0,0,0,4,0,0,0,0,0,0,0,0,0,0,0,0,0,0
1157,Barack Obama,Barack Obama,Mansfield,22,"610 - Remarks at a Campaign Rally in Mansfield, Ohio",remarks,2012,2012,0,0,0,0,0,0,0,0,6,0,0,0,4,0,0,0,0,0,0,0,0,0,0,0,0,0,0
1158,Barack Obama,Barack Obama,Leesburg,23,"614 - Remarks at a Campaign Rally in Leesburg, Virginia",remarks,2012,2012,0,0,0,0,0,0,1,0,10,0,0,0,7,0,0,0,0,0,0,0,0,0,0,0,0,0,0
1159,Barack Obama,Barack Obama,Winter Park,24,"612 - Remarks at a Campaign Rally in Winter Park, Florida",remarks,2012,2012,0,0,0,0,0,0,0,0,7,0,0,0,3,0,1,0,0,0,0,0,0,0,0,0,0,0,0
1160,Barack Obama,Barack Obama,Grand Junction,25,"627 - Remarks at a Campaign Rally in Grand Junction, Colorado",remarks,2012,2012,0,0,0,0,1,0,0,0,9,0,0,0,4,0,2,0,0,0,0,0,3,1,0,0,0,0,0
1161,Barack Obama,Barack Obama,Denver,26,"628 - Remarks at a Campaign Rally in Denver, Colorado",remarks,2012,2012,0,0,0,0,0,0,0,0,2,0,0,0,2,0,0,0,0,0,0,0,1,0,0,0,0,0,0
1162,Barack Obama,Barack Obama,Pueblo,27,"629 - Remarks at a Campaign Rally in Pueblo, Colorado",remarks,2012,2012,0,0,0,0,1,0,0,0,11,0,0,0,8,0,2,0,0,0,0,0,1,0,0,0,0,0,0
1163,Barack Obama,Barack Obama,Colorado Springs,28,"630 - Remarks at a Campaign Rally in Colorado Springs, Colorado",remarks,2012,2012,0,0,0,0,1,0,0,0,7,0,0,0,7,0,1,0,0,0,0,0,0,0,0,0,1,1,0
1164,Barack Obama,Barack Obama,Chicago,29,"635 - Remarks at a Campaign Rally in Chicago, Illinois",remarks,2012,2012,0,0,0,0,1,0,0,0,11,0,0,0,6,0,2,0,0,0,0,0,1,0,0,0,0,0,0
1165,Barack Obama,Barack Obama,Council Bluffs,30,"639 - Remarks at a Campaign Rally in Council Bluffs, Iowa",remarks,2012,2012,0,0,0,0,1,0,0,0,6,0,0,0,5,0,2,0,0,0,0,0,1,0,0,0,0,0,0
1166,Barack Obama,Barack Obama,Boone,31,"641 - Remarks at a Campaign Rally in Boone, Iowa",remarks,2012,2012,0,0,0,0,1,0,0,0,8,0,0,0,5,0,2,0,0,0,0,0,1,0,0,0,0,0,0
1167,Barack Obama,Barack Obama,Marshalltown,32,"644 - Remarks at a Campaign Rally in Marshalltown, Iowa",remarks,2012,2012,0,0,0,1,1,0,0,0,6,0,0,0,6,0,3,0,0,0,0,0,0,0,0,0,0,0,0
1168,Barack Obama,Barack Obama,Iowa,33,"642 - Remarks at a Campaign Rally in Oskaloosa, Iowa",remarks,2012,2012,0,0,0,0,1,0,0,0,13,0,0,0,8,0,4,0,0,0,0,0,0,0,0,0,0,0,1
1169,Barack Obama,Barack Obama,Waterloo,34,"645 - Remarks at a Campaign Rally in Waterloo, Iowa",remarks,2012,2012,0,0,0,0,1,0,0,0,9,0,0,0,5,0,3,0,0,0,0,0,0,0,0,0,0,0,1
1170,Barack Obama,Barack Obama,Davenport,35,"648 - Remarks at a Campaign Rally in Davenport, Iowa",remarks,2012,2012,0,0,0,0,0,0,0,0,5,0,0,0,7,0,4,0,0,0,0,0,0,0,0,0,0,0,0
1171,Barack Obama,Barack Obama,Dubuque,36,"646 - Remarks at a Campaign Rally in Dubuque, Iowa",remarks,2012,2012,0,0,0,0,0,0,0,0,8,0,0,0,4,0,4,0,0,0,0,0,0,0,0,0,0,0,0
1172,Barack Obama,Barack Obama,Windham,37,"652 - Remarks at a Campaign Rally in Windham, New Hampshire",remarks,2012,2012,0,0,0,0,0,0,0,0,8,0,0,0,6,0,2,0,0,0,0,0,0,0,0,0,0,0,0
1173,Barack Obama,Barack Obama,Rochester,38,"653 - Remarks at a Campaign Rally in Rochester, New Hampshire",remarks,2012,2012,0,0,0,0,0,0,0,0,6,0,0,0,7,0,2,0,0,0,0,0,0,0,0,0,0,0,0
1174,Barack Obama,Barack Obama,Columbus,39,"659 - Remarks at a Campaign Rally in Columbus, Ohio",remarks,2012,2012,0,0,0,0,0,1,0,0,6,0,0,0,1,0,6,0,0,0,0,0,5,3,0,0,0,0,0
1175,Barack Obama,Barack Obama,Reno,40,"660 - Remarks at a Campaign Rally in Reno, Nevada",remarks,2012,2012,0,0,0,0,0,1,0,0,2,0,0,0,1,0,7,0,0,0,0,0,2,0,0,0,0,0,0
1176,Barack Obama,Barack Obama,North Las Vegas,41,"662 - Remarks at a Campaign Rally in North Las Vegas, Nevada",remarks,2012,2012,0,0,0,0,0,2,1,0,2,0,0,0,0,0,6,0,0,0,0,0,0,0,0,0,0,0,0
1177,Barack Obama,Barack Obama,Ames,42,"670 - Remarks at a Campaign Rally in Ames, Iowa",remarks,2012,2012,0,0,0,0,2,0,0,0,5,0,0,0,6,0,1,0,0,0,0,0,0,0,0,0,0,0,0
